index,utterance_idx,utterance,video_id,sentiment
1213,17.0,I MEAN THE BLOOD IS LIKE TWILIGHT WITH SOME SCIFI WITH SOME ACTION AND WITH LIKABLE CHARACTERS AND THAT THAT IS IMPORTANT GUYS,ZUXBRvtny7o,1.6
1147,15.0,AND THE LAST BIG THING WAS UM JUST THE THE IT IT I KNOW ITS ABOUT JIJOE YOU KNOW OBVIOUSLY ITS GONNA BE ABOUT THE ARMY BUT IT JUST FELT LIKE UM LIKE UM MILITARY PROPAGANDA KIND OF LIKE YOU KNOW,8qrpnFRGt2A,-1.6
1206,10.0, ITS STUTTERING THAT IS A GOOD THING,ZUXBRvtny7o,1.25
315,3.0,UH I PERSONALLY THINK ITS A WASTE OF MONEY ,OtBXNcAL_lE,-1.2
1473,16.0,BECAUSE THE MINUTE THE SOUNDPLANE ENTERS THE GRID HE IS PUT IN THE GAMES,BioHAh1qJAQ,0.25
713,1.0,IM GONNA START OFF WITH SAYING THAT I REALLY WASNT VERY IMPRESSED WITH THE MOVIE,zhpQhgha_KU,-1.6
589,10.0,WHOEVER WROTE THIS ISNT THE WRITER DEFINATELLY,Dg_0XKD0Mf4,-1.6
95,15.0,COZ THE FIRST TWO WERE GREAT AND THEY BROUGHT IN THE KIDS AND IT MADE IT MORE KIDDY FRIENDLY MOVIE,k5Y_838nuGo,-0.8
837,13.0,BUT HE WASNT EVEN INTERESTING,rnaNMUZpvvg,-2.0
997,18.0,AND BASICALLY THIS MAKES NO SENSE ,QN9ZIUWUXsY,-1.8
936,5.0,AND MAYBE PLANET TERROR IM IM NOT SURE IM JUST,tmZoasNr4rU,-0.8
1416,13.0, IF AWARD FOR THE GREAT CHARACTERS OF SHREK IN HIS SUPPORTING CAST THEY ARE STILL VOICED BY THE ORIGINAL STARS MIKE MYERS EDDIE MURPHY CAMERON DIAZ AND ANTONIO BANDERAS THE FILM WOULD BE A REAL BUST,dq3Nf_lMPnE,-1.2
207,5.0,THE FIRST PROBLEM IS THAT ITS ALL TOLD IN FLASHBACK FROM A POINT JUST BEFORE KATRINA HITS NEW ORLEANS,f9O3YtZ2VfI,-1.8
1302,5.0, I HATE IT,atnd_PF-Lbs,-2.8
1184,14.0,THEY WERE JUST THEYRE JUST THEY JUST WHY ACTING WHAT THEYRE DOING ANYWAY,BvYR0L6f2Ig,-1.8
947,16.0,BUT I FEEL THAT THE MOVIE WASNT REALLY CONCERNED WITH BEING EXCITING,tmZoasNr4rU,-1.4
954,3.0, BECAUSE IT HAD A REAL NOSTALGIC FEEL TO IT,1DmNV9C1hbY,1.0
676,11.0,THIS CREDIT SEQUENCE I THINK IS THE BEST CREDIT SEQUENCE UM SINCE WATCHMAN,d3_k5Xpfmik,2.4
1,2.0,IT REACHED THE NEW HIGHTS OF HORRENDOUS,nbWiPyCm4g0,-2.4
222,20.0, BUT DONT GET ME WRONG ITS NOT ALL BAD,f9O3YtZ2VfI,-0.4
163,25.0,BUT UM FROM MY REVIEW IM GONNA SAY IM GONNA GIVE IT TWO THUMBS DOWN,Nzq88NnDkEk,-2.8
711,27.0,SO I MEANT IF I WAS WEARING 3D GLASSES AND WAS SEEING THIS IN 3D I WOULDVE ENJOYED IT A LOT MORE ,_dI--eQ6qVU,-0.4
312,31.0,BECAUSE THERE IS PEOPLE THAT WANNA GO AND SEE IT HAVENT SEEN IT YET AND MIGHT SEE THIS VIDEO ,Clx4VXItLTE,0.2
1377,3.0, SHE DIDNT REALLY DO ANYTHING FOR ME,Qr1Ca94K55A,-1.6
1527,24.0,BUT THEN YOU KIND OF LIKE WALK OUT OF THE MOVIE AND YOURE LIKE WELL I I GET WHAT HAPPENED I UNDERSTAND WHAT HAPPENED,2iD-tVS8NPw,-1.0
1101,32.0,HES A REALLY BAD ASS,2WGyTLYerpo,2.2
1323,5.0,THATS FREAKING EPIC ,cW1FSBF59ik,2.0
60,7.0,I DIDNT REALLY SEE A COMPARISON TO BLACK HAWK DOWN UNTIL LIKE THE VERY VERY END,jUzDDGyPkXU,-0.6
479,6.0,AND SUCKER PUNCH IS A FAILER BUT LIKE A REALLY AMBITIOUS WEIRD THE INTERESTING IDIOSYNCRATIC FAILURE,Oz06ZWiO20M,-0.8
1216,20.0, UM THE ENDING IS OPEN FOR A SEQUEL ,ZUXBRvtny7o,0.25
1151,19.0,I I GUESS UM BUT THE FUNNY THING IS UM I MEAN FUNNY THING IS DESPITE AS DESPITE EVERYTHING BAD ABOUT THIS MOVIE I ENDED UP HALF WAY LIKING IT,8qrpnFRGt2A,0.6
1279,15.0,BORING ,c7UH_rxdZv4,-2.4
1164,6.0,I ALSO THOUGHT SOME PARTS OF THE MOVIE WERE FUNNY FOR EXAMPLE UM GARGAMELS CAT FACIAL EXPRESSIONS,9c67fiY0wGQ,1.8
1022,13.0,ALL RIGHT SO ENOUGH OF THE NUDITY,7JsX8y1ysxY,-1.6
908,1.0, AND HE REALLY SEEMS TO BE CHANNELING MICHAEL BAY IN THIS MOVIE ,nzpVDcQ0ywM,0.0
1507,4.0, ITS A HUGE SORT OF SPECTACLE MOVIE THAT IS GREAT FOR THIS SUMMER TIME YOU KNOW,2iD-tVS8NPw,2.2
1479,22.0,THE WRITERS JUST PULL THIS OUT OF THEIR ASS,BioHAh1qJAQ,-2.2
1231,1.0,I JUST WANTED TO LET YOU KNOW THAT 3D IS REALLY RIDICULOUSLY EXPENSIVE,MLal-t_vJPM,-1.2
441,21.0,UM BUT THIS LOOKED AMAZING LOOKED REALLY GOOD ,LSi-o-IrDMs,2.8
1143,11.0,WHICH I MEAN FOR A MOVIE ABOUT JI JOE NINTY MINUTES IS ENOUGH,8qrpnFRGt2A,-0.8
19,10.0,AND SECONDLY BECAUSE AS A MARVELL GEEK I HAVE EXPERIENCED MY FAIR SHARE OF DISAPPOINTMENTS OVER THE LAST DECADE AND I CAN GENUINLY SYMPHATIZE WITH YOU,Af8D0E4ZXaw,-0.75
1418,15.0,I GIVE SHREK FOREVER AFTER DIRECTED BY MIKE MITCHELL A GRADE OF B MINUS,dq3Nf_lMPnE,1.0
1106,37.0, HARRISON FORD IS ALSO GOOD,2WGyTLYerpo,1.4
198,28.0,UH I RATED IT FOUR OUT OF FIVE STARS,W8NXH0Djyww,1.8
684,19.0,AND THE STYLE OF THE FILM LIKE THE UM THE FREE STREAMS OF SLOW MOTION THE UM THE JUMP COOKS AND ALL THAT STUFF FEELS VERY KIND OF UM TARANTINO ASK ,d3_k5Xpfmik,0.2
417,36.0,IT WASNT THE IT WASNT THE USUAL ,I5y0__X72p0,-1.2
529,12.0, HE WAS VERY GOOD IN HELLBOY,d6hH302o4v8,1.4
657,36.0,AND IT DIDNT EVEN YOU KNOW TRY TO CLOSE IT AT ALL LIKE THE WIND ISNT GONNA BLOW IT OVER OR ANYTHING ITS JUST OPEN,Ci-AH39fi3Y,-1.5
1344,2.0, IF YOU ARE AS BIG A FAN OF DISNEY AS I AM,cM3Yna7AavY,2.5
469,20.0,ITS EXTREMLY WELL MADE ,5W7Z1C_fDaE,2.8
1185,15.0,I DONT KNOW THEY DO SEEM THEY NEED TO LEARN ACTING BETTER ,BvYR0L6f2Ig,-1.2
411,30.0, SO IT IT WAS AND INTERESTING MOVIE,I5y0__X72p0,1.6
1485,28.0,AND CLUE HAS TO BE ONE OF THE MOST IDIOTIC VILLAINS EVER CAUSE WHAT IS A WHAT IS CLUE,BioHAh1qJAQ,-2.0
903,12.0, ITS COLORFUL,Iu2PFX3z_1s,1.6
952,1.0,BUT FOR THIS ONE I JUST DIDNT FEEL LIKE IT,1DmNV9C1hbY,-2.0
600,3.0,NUMBER ONE IT MEANS ITS MUCH SCARIER THAN YOU COULD IMAGINE,yDtzw_Y-7RU,0.75
942,11.0,AND UH ALTHOUGH LIKE I LIKE DARK HUMOR,tmZoasNr4rU,-0.6
1389,1.0,AND I THOUGHT THIS MOVIE WAS GONNA BE REALLY GOOD BECAUSE MATT DAMON WAS IN IT,c5xsKMxpXnc,-0.75
1381,7.0,AND WHATEVER SO NO IM NOT SAYING THIS MOVIE IS BAD COZ ITS ITS NOT,Qr1Ca94K55A,-0.8
626,5.0,AND EXCITED TO SEE IT ,Ci-AH39fi3Y,1.6
758,11.0,UM I I LIKED AGENT BRODYS CHARACTER,8d-gEyoeBzc,1.6
309,28.0,I THINK THATS HOW THEY COPE WITH GETTING JUM LIKE SCARED AND JUMP AND STUFF,Clx4VXItLTE,0.4
1174,4.0,BUT IN SOME WAYS THE FIRST ONE WAS BETTER ,BvYR0L6f2Ig,-1.0
1104,35.0,AND HE DOES A REALLY GOOD JOB,2WGyTLYerpo,2.2
244,12.0, GINNIFER GOODWIN IS FUN TO WATCH ,iiK8YX8oH1E,1.8
644,23.0, BECAUSE I SURE DIDNT SEE THE END COMING,Ci-AH39fi3Y,0.0
220,18.0, THIS LOOKS LIKE IT JUST HAS A POLYURETHANE COATING ON IT ,f9O3YtZ2VfI,-1.0
225,23.0, AND THEY DID A LOT OF GOOD THINGS WITH IT,f9O3YtZ2VfI,1.6
123,12.0,BUT IT ALL TURNS OUT GREAT IN THE END,6Egk_28TtTM,2.4
1474,17.0,AND LET ME TELL YOU THE GAMES LOOK GREAT,BioHAh1qJAQ,2.4
748,1.0, UM IM GONNA GIVE THE REASONS WHY I LIKE HIM ,8d-gEyoeBzc,1.2
821,19.0,I THOUGHT IT WAS FUN,vyB00TXsimI,1.2
946,15.0,MAYBE A LOT MORE THAN THE EXPENDABLES,tmZoasNr4rU,0.25
660,39.0,SO CONGRATULATIONS TO THE WRITERS FOR THAT,Ci-AH39fi3Y,2.0
1013,4.0,SO THIS WAS PRETTY FUNNY ,7JsX8y1ysxY,1.4
1307,10.0,ITS A JOKE REALLY,atnd_PF-Lbs,-2.4
904,13.0,ITS IN YOUR FACE,Iu2PFX3z_1s,0.25
847,1.0, MILA KUNIS AND JUSTIN TIMBERLAKE I THOUGHT THEY MADE A GREAT DUO,Jkswaaud0hk,2.4
610,13.0,UM ALL THIS STUFF ABOUT DEBTORS PRISON FOR INSTANCE DOESNT REALLY UM JIVE HERE IN 21ST CENTURY AMERICA,yDtzw_Y-7RU,-1.8
631,10.0, ONE OF THEM WAS GREAT,Ci-AH39fi3Y,1.0
649,28.0,UM SO YOU KNOW THAT WAS A LITTLE SURPRISING I GUESS,Ci-AH39fi3Y,0.4
778,1.0,THIS MOVIE IS ADORABLE,9J25DZhivz8,2.2
419,38.0,THE MUSIC KINDA DROVE A LOT OF THE ACTION,I5y0__X72p0,0.2
719,7.0,AND A FEW FUNNY PARTS,zhpQhgha_KU,1.0
368,9.0, WELL ITS A JOHNNY DEPP MOVIE SO ITS ENTERTAINING,WKA5OygbEKI,1.4
159,21.0,SO UNFORTUNATELLY I MUST SAY THIS ONE IS PROBABLY GONNA BE WAITING UNTIL IT COMES ON HBO ,Nzq88NnDkEk,-1.2
1476,19.0,UM THE CHO THE CHOREOGRAPHY OF THE FIGHTS THE SPECIAL EFFECTS I WAS SO HAPPY TO BE BACK IN THE GRID THAT I WASNT REALLY THINKING ABOUT THE STORY OR WHERE THE STORY WAS GOING,BioHAh1qJAQ,1.8
1320,2.0,FIRST OF ALL ID LIKE TO SAY LITTLE WOLVER JAMES OR JIMMY HES SO CUTE HES SO XXX ,cW1FSBF59ik,3.0
879,13.0, THE SECOND REASON THIS MOVIE WAS MADE AND IN MY OPINION THE REAL REASON IT WAS MADE AGAIN ITS SILVESTRE STALONE TELLING HIMSELF I STILL GOT IT,bvLlb-M3UXU,-1.2
525,8.0,HES VERY BORING,d6hH302o4v8,-2.2
317,5.0, LAUGHING I JUST JUST CANT STAND MOVIES WHERE ITS LIKE THE SAME PLOT AS LIKE 50 OTHER MILLION MOVIES,OtBXNcAL_lE,-2.8
1283,19.0,YOU CANT EVEN TELL FUNNY JOKES,c7UH_rxdZv4,-1.8
120,9.0, LIKE FOR EXAMPLE MY BROTHER IS FIVE YEARS OLD AND HE DIDNT THINK THIS MOVIE WAS SCARY AT ALL,6Egk_28TtTM,-0.4
864,18.0, UNLESS YOU LADIES GO TOGETHER TO SEE IT TOGETHER,Jkswaaud0hk,0.6
807,5.0,AND IS FUN TO WATCH,vyB00TXsimI,1.8
738,26.0,I THINK THAT THEY ALL HAVE LIKE A LOT OF ISSUES,zhpQhgha_KU,0.0
1255,7.0,BUT NOTHING SUCKS EITHER WHICH GAINS THE MOVIE SOME POINTS I GUESS,pLTX3ipuDJI,0.8
1365,7.0,THEY PRETEND THERES GONNA BE THIS BIG SCENE IT MAYBE LASTS ABOUT A MINUTE AND I WAS LIKE IS THAT IT,OQvJTdtJ2H4,-1.6
1199,3.0,BUT I WENT AND I DIG THIS MOVIE,ZUXBRvtny7o,1.0
461,12.0,MELISSA LEO WILL HAVE YOU CREEPED OUT TO YOUR INNER CORE WITH HER TINY LITTLE SMILE,5W7Z1C_fDaE,0.8
172,2.0, SURPRISED ME,W8NXH0Djyww,-0.25
772,25.0,PREDATOR IS REALLY WELL PACED MOVIE,8d-gEyoeBzc,1.8
133,10.0,EVEN THOUGH THE WHOLE MOVIE IS BASED ON WHETHER SHE GETS TO DUBLIN IN TIME YOURE NEVER REALLY WORRIED ABOUT IT BECAUSE YOU KNOW SHE GETS THERE,TvyZBvOMOTc,-0.4
844,20.0,HE LOOKED AWESOME WHILE HE DID IT BUT YEAH OK SO LET ALL THE GIRLS WHO WANT ALL DISAGREE WITH ME COZ THEY ALL THINK THIS IS AN AMAZING MOVIE BUT THEY ALL THINK HE WAS AMAZING BECAUSE THEY WERE STARING AT DANIEL CRAIG THE WHOLE TIME THEYR GOING OH MY GOSH HES SO HOT,rnaNMUZpvvg,0.8
721,9.0,I DONT KNOW I JUST THOUGHT I JUST THOUGHT IT WAS REALLY REALLY SAD,zhpQhgha_KU,-1.0
179,9.0,THE ALL THE ANIMALS WERE JUST SO FUNNY,W8NXH0Djyww,2.0
429,9.0,I GUESS FOR THIS KIND OF MOVIE THE PLOT IS IS IS THREADBARE,LSi-o-IrDMs,-1.0
36,27.0,THE ACTING RANGES FROM MEDIOCRITY TO HAMFISTED FROM THE LIVE ACTION ACTORS,Af8D0E4ZXaw,-1.6
318,6.0,JUST DIFFERENT JUST DIFFERENT PEOPLE PLAYING THE ROLES,OtBXNcAL_lE,0.4
972,7.0, UM FUNNY JOKES THAT THE KIDS WOULD GET,6_0THN4chvY,0.8
1251,3.0,ALTHOUGHT WHAT WASNT THE SAME WAS THE CONNECTION TO EACH OTHER WHICH FIRST MOVIE HAD AND THIS ONE NOT,pLTX3ipuDJI,-1.2
1156,24.0,I MEAN THIS MOVIE MAKES UM MAKES UM STAR WARS PRETTY CLOSE,8qrpnFRGt2A,0.0
962,11.0, BUT FOR ME I WAS JUST A LITTLE BORED,1DmNV9C1hbY,-1.8
1229,33.0, CAUSE ITS WORTH IT,ZUXBRvtny7o,0.8
173,3.0,UH IT WAS SO MUCH BETTER THAN I THOUGHT IT WAS GOING TO BE,W8NXH0Djyww,2.4
1415,12.0, IT SEEMS LIKE THE WRITERS AND CREATORS TOOK THE EASY WAY OUT,dq3Nf_lMPnE,-1.6
737,25.0,AND I THINK THAT THATS THATS A VERY RELATABLE ISSUE,zhpQhgha_KU,1.0
224,22.0, LIKE I SAID BEFORE IS A VERY INTERESTING IDEA,f9O3YtZ2VfI,1.4
696,12.0, BUT THE HUMOR REALLY JUST NAILED IT,_dI--eQ6qVU,2.6
106,26.0,BUT IT AS GREAT,k5Y_838nuGo,2.0
1170,12.0,SINCE THE SMURFS ARE SO ADORABLE AND THEY GO ON THRILLING ADVENTURES,9c67fiY0wGQ,2.0
917,10.0,BECAUSE THEY ARENT PLAYING TO YOU THEYRE PLAYING TO A NEW AUDIENCE OF KIDS WHO DONT KNOW ANYTHING ABOUT THESE CHARACTERS IN THE FIRST PLACE,nzpVDcQ0ywM,-1.0
291,10.0,LIKE IT DOSNT JUST LIKE AND I WAS AT UM THERES A PROBLEM THERES A STORY LIKE ADN ITS LIKE STREIGHT AWAY FUN STORYLINE STARTED,Clx4VXItLTE,0.2
1066,18.0,AND WE REALLY WANTED TO GET OUT OF THE HOUSE UM LAST NIGHT,G-xst2euQUc,0.0
1193,23.0,BUT MARY ELIZABETH WINSTEAD I MUST SAY SHE IS A TERIFFIC AND BEAUTIFUL AND TALENTED ACRESS,BvYR0L6f2Ig,2.4
444,24.0,I WOULD LOVE THAT,LSi-o-IrDMs,1.8
40,31.0,BUT STILL ITS THAT KIND OF MOVIE MAKING ,Af8D0E4ZXaw,-0.4
850,4.0,YOU GUYS ARE YOURE GONNA GET TO ENJOY,Jkswaaud0hk,1.0
269,19.0, BUT DONT EXPECT MUCH ,Bfr499ggo-0,-1.8
1461,4.0,AND EVERYTHING AND NOW TECHNOLOGY ACTUALLY DOES ANYTHING AND EVERYTHING,BioHAh1qJAQ,0.25
798,21.0, THAT WAS A GREAT EFFECT,9J25DZhivz8,1.2
896,5.0,UM WHAT REALLY NEED ABOUT THIS MOVIE IS THE CHAMICAL BROTHERS DID THE SOUNDTRACKS WHATS PULSE POUNDING THE ENTIRE WAY THROUGH,Iu2PFX3z_1s,1.4
0,1.0,AND LET ME TELL YOU IT SURPASSED ITSELF,nbWiPyCm4g0,1.2
278,6.0,UH IF YOU LIKE THE KIND OF MOVIE THAT BEN STILLER DID A NIGHT AT THE MUSEUM THEN YOU PROBABLY WOULD LIKE SOMETHING UH LIKE THIS,ZAIRrfG22O0,1.4
1146,14.0, I THOUGHT THAT TWO HOURS WAS WAY TOO LONG FOR THIS MOVIE,8qrpnFRGt2A,-1.8
59,6.0,IN FACT THIS MOVIE ISNT EVEN ON THE SAME LEVEL AS DISTRICT 9 NOR IS IT UM FOR UH BLACK HAWK DOWN WHICH PEOPLE ARE COMPARING IT TO,jUzDDGyPkXU,-1.6
265,15.0, BUT ALSO NOT NECESSARY,Bfr499ggo-0,-1.0
675,10.0,UM ITS BASICALLY A UM SLOW MOTION SHOW CASE OF DIFFERENT EVENTS,d3_k5Xpfmik,0.4
613,16.0,AND THROUGHOUT THE FILM YOURE GOING SOUND EFFECTS LAUGHING EITHER FROM THE TERRIFYING CHARACTERS,yDtzw_Y-7RU,0.6
911,4.0,SIGH ALL IN ALL ITS KIND OF A DISAPPOINTMENT TO ANY OF US WHO GREW UP IN THE 80S AND ARE USED TO THE TOYS IN THE CARTOON,nzpVDcQ0ywM,-1.6
55,2.0,THE ACTION IS REALLY REALLY WELL DIRECTED,jUzDDGyPkXU,2.6
646,25.0,BUT I THOUGHT THE BEST PART OF SAW 5 WAS THE STORYLINE LIKE IN GENERAL,Ci-AH39fi3Y,1.8
1521,18.0,THATS REALLY THE ROUTE THAT YOURE GONNA GO ,2iD-tVS8NPw,0.3333333333329999
977,12.0,SO UM IF YOU HAVENT SEEN WINNIE THE POOH AND YOU LIKE FAMILY FILMS GO SEE IT,6_0THN4chvY,1.8
1260,12.0, HE CO LAURENCE FISHBURNE COMES IN AND TELLS THE CHARACTERS THINGS THAT ONLY SCREEN WRITERS SHOULDVE KNOWN ABOUT WHICH GIVES A LITTLE MORE OF F FONY FEEL THIS WHOLE THING,pLTX3ipuDJI,-2.0
156,18.0,AND ACTUALLY THE GUY SITTING NEXT TO ME ACTUALLY WAS TAKING A NAP LAUGHTER HE KEPT DOZING OFF ,Nzq88NnDkEk,-1.4
1343,1.0,I JUST GOT BACK FROM THE MOVIE THEATERS TO GO SEE A MOVIE IVE BEEN WAITING PROBABLY ABOUT A YEAR AND A HALF TO TWO YEARS FOR,cM3Yna7AavY,2.2
916,9.0,BUT IF YOU ARE A CHILD WHO GREW UP IN THAT TIME PERIOD YOURE NOT GOING TO ENJOY THIS MOVIE VERY MUCH ,nzpVDcQ0ywM,-2.2
885,19.0,BECAUSE YOU KNOW ITS BASICALLY IT WAS STALONE KNOWING THESE GUYS ARENT IN THE SHAPE THEY WERE TWENTY TWENTY FIVE YEARS AGO ,bvLlb-M3UXU,1.2
1226,30.0, THE ACTING IS ITS NORMAL ITS NOT BAD ITS NOT BAD AT ALL,ZUXBRvtny7o,0.4
363,4.0,I WILL ADMIT IM A BIG JOHNNY DEPP FAN,WKA5OygbEKI,1.8
1121,52.0,BUT I WAS KIND OF EXPECTING THAT ,2WGyTLYerpo,0.0
171,1.0, NOW RANGO WAS JUST FANTASTIC,W8NXH0Djyww,2.8
117,6.0,AND I WOULD RECOMMEND THIS MOVIE FOR AGES 3 AND UP,6Egk_28TtTM,2.0
237,5.0,UM IT KIND OF FOLLOWS THE PATH OF MY BEST FRIENDS WEDDING 1997 JULIA ROBERTS MOVIE EXCEPT IT TAKES THIRTY MINUTES LONGER TO DEVIATE FROM THE SCRIPTS OF MY BEST FRIENDS WEDDING,iiK8YX8oH1E,-0.4
1173,3.0,BUT THE SECOND ONE IT DIDNT IN SOME WAYS TAKE TO THE NEXT LEVEL,BvYR0L6f2Ig,0.4
895,4.0,AND HE PUTS THEM IN VERY STRANGE AND UNUSUAL CHARACTERS,Iu2PFX3z_1s,0.0
1258,10.0, BUT ITS JUST A LITTLE WEAK OVERALL FOR ME THAN WE WERE LOOKING FORWARD TO HIM AND HE WAS GONE QUICKLY,pLTX3ipuDJI,-1.6
974,9.0,BECAUSE HE SAYS ISSUE AND THEY THINK HE IS SAYING AT YOU,6_0THN4chvY,-0.6
502,4.0,IT WAS A GOOD BOOK,73jzhE8R1TQ,1.6
1160,2.0,BUT I ACTUALLY FOUND MYSELF ENJOYING THE MOVIE AND LAUGHING ,9c67fiY0wGQ,1.8
681,16.0, THE XXX SEQUENCE IS REALLY WELL DONE,d3_k5Xpfmik,2.0
597,18.0,SO YEAH GO SEE IT,Dg_0XKD0Mf4,1.4
1219,23.0,I REALLY DIG THIS MOVIE,ZUXBRvtny7o,0.8
432,12.0,ITS A POPCORN MOVIE,LSi-o-IrDMs,-0.5
1411,8.0, SHREK 4 MISSES OUT ON THE MAGIC THAT MADE THE FIRST FILM A REAL JOY TO VIEW,dq3Nf_lMPnE,0.6
1332,14.0,UM LIP SMACKING SIGH HM MARVEL ONCE AGAIN DECIDED TO TOSS ANOTHER RANDOM BITCH IN THIS MOVIE WOLVERINES BITCH,cW1FSBF59ik,-1.2
138,15.0,ALL IN ALL IF YOURE LOOKING FOR A CUTE ROMANTIC COMEDY WITH A BEAUTIFUL SETTING THEN THIS WILL PROBABLY BE A GOOD MOVIE FOR YOU,TvyZBvOMOTc,2.0
148,10.0,BECAUSE I JUST FELT LIKE IT WAS IT SEEMED LIKE IT WAS A RUSHED MOVIE ,Nzq88NnDkEk,-1.4
111,31.0,BECAUSE MY ONE OF MY COUSINS DOESNT LIKE THE GLASSES ,k5Y_838nuGo,-1.0
1502,15.0, I KIND OF HAVE A UM ARTISTIC VIDEO UP ON MY MAIN CHANNEL,tStelxIAHjw,0.4
253,3.0,BUT IF YOU LOVED THE SERIES AND YOU ALSO LIKED XXX THE FIRST MOVIE THAN YOURE STILL GONNA HAVE FUN ,Bfr499ggo-0,1.6
1268,4.0,BECAUSE I TRULY LOVE AN ACTION FLICK ACTION COMEDY FLICK EVEN BETTER RIGHT,c7UH_rxdZv4,1.6
832,8.0,ALL THE CHARACTERS WERE JUST SO UNLIKABLE,rnaNMUZpvvg,-1.6
1293,29.0,WHO SEEMED TO HAVE GENUINE AFFECTION FOR OTHER HUMAN BEINGS,c7UH_rxdZv4,0.6
661,40.0, BUT ILL SMACK THEM IN THE FACE FOR THE OTHER IRRELEVANT PLOTLINE,Ci-AH39fi3Y,-2.6
1405,2.0,THE LAST MINUTE TITLE THAT THEY THREW ON AT THE THEATERS,dq3Nf_lMPnE,-1.4
127,4.0,AND IN THE SCENE WITH THE DESTROYED CASTLE IT REALLY REMINDED ME WHY I WANT TO GO THERE SO BADLY,TvyZBvOMOTc,1.4
848,2.0, MILA KUNIS SHE IS GORGEOUS,Jkswaaud0hk,2.0
725,13.0,LIKE IT COULDVE BEEN SHORTER,zhpQhgha_KU,-1.0
42,2.0,THAY DID THEY DIDNT REALLY DO A WHOLE BUNCH OF BACKGROUND INFO ON WHY SHE HAS TO FIGHT AND BE PREPARED,03bSnISJMiM,-0.8
1014,5.0,COZ PEOPLE WERE LIKE EATING POPCORN AND YOU SEE THE FIRST SHOW AND PEOPLE YOU HEAR LIKE THIS THIS RIPPLE EFFECT OF WHISPERING OH MY GOD IS THAT A IS THAT AM I LOOKING AT THIS RIGHT WHAT ,7JsX8y1ysxY,1.0
341,5.0, BUT THERES A REASON FOR THAT THERES A REASON FOR WHY I WAS CONFUSED,8OtFthrtaJM,-0.2
1399,11.0, I MEAN YOU DONT SEE WHY THESE TWO PEOPLE LOVE EACH OTHER,c5xsKMxpXnc,-0.8
1370,12.0,SO IT IS NOT A BUY,OQvJTdtJ2H4,-1.25
478,5.0,LIKE I WAS MORE ENTERTAINED BY IT THAN BATTLE LA WHICH WAS JUST A SLOG AND BORING AND I JUST TRY TO TOTALLY UNINTERESTING ,Oz06ZWiO20M,0.2
1060,12.0,THAT SO WHAT IS STILL A REALLY GREAT MOVIE TO TAKE YOUR WHOLE FAMILY TO,G-xst2euQUc,1.8
1471,14.0,THE SPECIAL EFFECTS LOOK AMAZING,BioHAh1qJAQ,2.6
670,5.0, ZOMBIELAND IS A REALLY SUCESSFUL HORROR COMEDY,d3_k5Xpfmik,2.2
453,4.0,ITS STRONG,5W7Z1C_fDaE,0.4
769,22.0, UM I JUST DIDNT THINK IT WAS WELL DEVELOPED ENOUGH AND UM I ALSO I I INCLUDE IN THAT LAURENCE FISHBURNES CHARACTER AS WELL ,8d-gEyoeBzc,-1.0
1385,11.0,AND SOME REALLY COOL GUN FIGHTS,Qr1Ca94K55A,2.0
602,5.0, LET ME SAY THIS IF YOUR CHRISTIANITY IS EXTREMELY LEGALISTIC THIS IS THE FILM FOR YOU,yDtzw_Y-7RU,0.5
705,21.0,IT ENGAGES THE AUDIENCE MORE,_dI--eQ6qVU,1.8
267,17.0, AND UM IT WAS JUST FUN TO SEE YOUR OLD FRIENDS AGAIN,Bfr499ggo-0,1.4
741,29.0,BUT ALL IN ALL WASNT REALLY THAT BIG OF A FAN,zhpQhgha_KU,-1.2
1278,14.0, UM KATO KICKS ASS HANDSOME GUY,c7UH_rxdZv4,1.2
73,20.0,EVERYTHING THEY SAY JUST SOUNDS SO FUCKING STUPID,jUzDDGyPkXU,-2.2
594,15.0, OTHER THAN THAT UM I THINK IT WAS AND OK MOVIE,Dg_0XKD0Mf4,0.8
1098,29.0,HE KIND OF CHANNELS THE MAN WITH NO NAME CLINT EASTWOOD ,2WGyTLYerpo,0.6
1127,58.0,NOT A HUGE FLAW BUT ITS THERE AND ITS NOTICABLE,2WGyTLYerpo,-1.4
1089,20.0,THEY ARE HUGE ,2WGyTLYerpo,1.0
69,16.0,AND IT KEEPS YOUR INTERESTS IN THE ACTION SCENES AT LEAST DURING THIS MOVIE,jUzDDGyPkXU,1.2
958,7.0,AND UM WHILE THE TRAILER MADE THE FILM LOOK REAL NICE AND CUTE ,1DmNV9C1hbY,-1.6
45,5.0,AND THEY SHOULDVE I GUESS ,03bSnISJMiM,0.0
412,31.0,IT WAS ORIGINAL,I5y0__X72p0,1.6
671,6.0, AS IT CONTAINS UM REA REALLY WELL DONE AND FAITHFUL HOMAGES TO THE ZOMBIE HORROR SUB GANRE,d3_k5Xpfmik,1.6
998,1.0,I WAS A LITTLE BIT DISAPPOINTED IN THE FILM,PZ-lDQFboO8,-1.4
4,5.0,ALSO IF YOURE A STREIGHT MAN AND YOU VOLUNTARILY WILLINGLY GOO AND SEE THIS FILM IM GONNA NEED YOU TO LIGHT A CANDLE SAY A PRAYER AND ASK YOURSELF SOME QUESTIONS,nbWiPyCm4g0,-1.4
487,14.0,AND I KNOW THIS IS GONNA SOUND SILLY COZ ITS SUCH A BROAD GOOFY MAINSTREAM CULT KIND OF MOVIE,Oz06ZWiO20M,1.0
184,14.0,AND HE DID A WONDERFUL JOB,W8NXH0Djyww,2.2
168,30.0,AND UM BUT I GOT TO I GOT TO DO MY DUTY AND LET YOU GUYS KNOW ITS A A MAJOR SUCK FEST,Nzq88NnDkEk,-3.0
1509,6.0,AND YOU WANNA SEE IT IN 3D ,2iD-tVS8NPw,2.0
1463,6.0,UNFORTUNATELY UM THE WRITERS AND I WERE NOT EXACTLY ON THE SAME WAVELENGTH,BioHAh1qJAQ,-1.8
23,14.0,THEY ARE GREAT ADDITIONS,Af8D0E4ZXaw,1.6
1179,9.0,FIRST IM GONNA GET INTO THE ACTING WHICH WAS MUCH MUCH BETTER THAN THE SECOND ONE,BvYR0L6f2Ig,2.2
990,11.0,UM THE DIRECTION IS A BIT ITS WOBBLY,QN9ZIUWUXsY,-1.2
1383,9.0, IT WAS IT WAS GOOD,Qr1Ca94K55A,1.8
623,2.0, AS SOME OF YOU MIGHT NOT NOTICE I WAS EXTREMLY EXCITED ABOUT SAW 5,Ci-AH39fi3Y,2.0
559,42.0, I DONT KNOW WHY I EVEN SAW IT,d6hH302o4v8,-1.4
1498,11.0,I JUST HATED IT,tStelxIAHjw,-2.8
504,6.0,SO YEAH AND THE MOVIE WAS PRETTY GOOD IN MY OPINION,73jzhE8R1TQ,1.8
86,6.0,BUT THE FIRST TWO WERE PRETTY EXCELLENT,k5Y_838nuGo,2.0
281,9.0,BUT UH THERES DEFINITELY FAR BETTER MOVIES THAT YOU CAN UH GO SEE THAN UM TONGUE CLICKING THAN ZOOKEEPER,ZAIRrfG22O0,-1.6
1452,4.0,I WOULDNT WANT THAT POINTED AT ME,Vj1wYRQjB-o,-0.8
1140,8.0,UM AND AGAIN I I IF I HAD TO PAY CLOSER ATTENTION I MIGHT HAVE FOLLOWED IT MORE,8qrpnFRGt2A,-0.8
1142,10.0, UM UM THIS MOVIE THIS MOVIE UM BY HALF WAY THROUGH I WAS CHECKING THE TIME AND SAW THAT THIS MOVIE WAS TWO HOURS LONG,8qrpnFRGt2A,-2.2
1243,13.0,BUT HE MIGHT AS WELL ,MLal-t_vJPM,0.8
201,31.0,UM EVERYTHING ELSE HELD UP ITS OWN,W8NXH0Djyww,0.6
183,13.0,AND THE STUFF HE SAID WAS JUST IT WAS JUST SO FUNNY,W8NXH0Djyww,2.2
422,2.0,BECAUSE THE MOVIE ITSELF IS THE SAME OLD CRAP FROM THE SERIES ,LSi-o-IrDMs,-2.0
1514,11.0,ITS NOT LIKE A DARK MOVIE OR ANYTHING,2iD-tVS8NPw,0.2
1353,11.0,I LIKED LILO AND STICH ,cM3Yna7AavY,2.0
27,18.0,IT WAS BY FAR MY FAVORITE ACTION SEEN IN THE MOVIE,Af8D0E4ZXaw,2.2
1051,3.0,I REALLY DIDNT WANNA GO SEE IT,G-xst2euQUc,-1.4
625,4.0,SO I WAS YOU KNOW REALLY HYPED UP,Ci-AH39fi3Y,1.8
516,18.0,AND YOU PROBABLY DONT THINK SO BUT YOU KNOW JUST ONE OF THOSE LITTLE THINGS THAT THAT HURT YOU FOR SOME REASON YOU KNOW WHAT I MEAN,73jzhE8R1TQ,-1.6
865,19.0,SO ID GO SEE IT ,Jkswaaud0hk,1.8
747,35.0,UM SO IF YOU LIKE TO HEAR A UM LIKE MORE POSITIVE REVIEW CHECK OUT HER REVIEW IT IS VERY GOOD,zhpQhgha_KU,0.6
1210,14.0,AND THE ENDING WAS REALLY REALLY GREAT TOO,ZUXBRvtny7o,2.6
1391,3.0,LIKE THEY TALK FOR LIKE FIVE MINUTES AND INSTANTLY KISS WHICH IS DUMB ,c5xsKMxpXnc,-1.8
1077,8.0,COZ THE VISUAL EFFECTS ARE PRETTY COOL,2WGyTLYerpo,1.8
791,14.0,BUT OTHERWISE I THOUGHT HE WAS EXCELLENT,9J25DZhivz8,1.8
749,2.0,BUT MOSTLY IM GONNA GIVE THE REASONS OF WHY I DONT THINK HES GONNA BE A CLASSIC IN THE SAME WAY AS THE FIRST MOVIE PREDATOR OR ALIENS,8d-gEyoeBzc,-0.8
756,9.0,THE CHARACTERS WERE WELL DEVELOPED UM NOT ALL OF THE CHARACTERS,8d-gEyoeBzc,1.4
339,3.0,I LITERALLY SAID OUT LOUD WHAT QUE WHAT IS THIS MOVIE THAT I AM SEEING WHAT IS THIS,8OtFthrtaJM,-2.4
532,15.0,HES VERY BORING AS WELL,d6hH302o4v8,-1.75
509,11.0,AND BUT XXX WERE TOO HOLLYWOOD FOR ME,73jzhE8R1TQ,-1.2
1235,5.0, ITS PROBABLY THE BEST THING CURRENTLY IN THEATERS,MLal-t_vJPM,2.2
1124,55.0,AND SOMETIMES IT KIND OF VEERS INTO CLICHE ACTION MOVIE TERRITORY,2WGyTLYerpo,-1.0
410,29.0,AND IT VISUALLY ITS KINDA COOL HOW THEY SHOW HER CONFUSION BECAUSE SHE GROWS UP IN THE WOODS,I5y0__X72p0,1.8
805,3.0, IF YOU LIKE EXPLOSIONS REALLY RIDICULOUS ACTION SEQUENCES MALODRAMATIC PLOT AND ACTING THIS IS THE RIGHT MOVIE TO SEE,vyB00TXsimI,2.2
541,24.0, IT WAS VERY VERY VERY BORING,d6hH302o4v8,-2.8
299,18.0,HUH BUT I AM IT WAS JUMPY,Clx4VXItLTE,-0.5
1327,9.0,BUT I DO NOT TAKE RYAN REYNOLDS SERIOUSLY FOR SHIT IN THIS MOVIE,cW1FSBF59ik,-2.4
1516,13.0,SO ITS PERFECT FOR KIDS AS WELL AS JUST LIKE TEENAGERS AS WELL WHO JUST WANNA SEE A LOT OF EXPLOSIONS AND SOME CRAZY STUFF ,2iD-tVS8NPw,2.2
176,6.0,I DUNNO BUT IT WAS IT WAS COOL,W8NXH0Djyww,1.6
651,30.0,BUT IT WAS NOT EXECTLY WHAT I WAS EXPECTING AND SE SERIOUSLY EVERYTHING LEADING UP TO THE END WAS BETTER THAN THE ENDING ,Ci-AH39fi3Y,-1.0
1362,4.0,UM IT WAS VERY HARD TO FOLLOW,OQvJTdtJ2H4,-2.0
109,29.0,AND I DONT THINK THAT MANY OTHER PEOPLE WERE LAUGHING ABOUT IT,k5Y_838nuGo,-0.75
194,24.0,UM BUT THIS MOVIE IT HAD EVERYTHING HUMOR ROMANCE ACTION,W8NXH0Djyww,2.6
537,20.0,UH THE TRAILER LOOKED LIKE IT COULD BE A LITTLE G GOOD,d6hH302o4v8,1.0
767,20.0,UM HE HAD SOME FUNNY HE HAD A FEW ONE LINES THAT WAS QUITE QUITE FUNNY,8d-gEyoeBzc,1.2
534,17.0,IT MADE NO SENSE ,d6hH302o4v8,-2.0
1465,8.0,ITS THE BEST SUMMER MOVIE IVE SEEN ALL YEAR,BioHAh1qJAQ,2.4
742,30.0,BECAUSE THERE REALLY WASNT ALL THAT MUCH TO IT FOR ME,zhpQhgha_KU,-2.0
416,35.0,BUT IT WAS IT WAS INTERESTING,I5y0__X72p0,1.8
991,12.0,BASICALLY A LOT OF ELEMENTS THAT I COULD TAKE A MOVIE ON ITS REALLY WOBBLY,QN9ZIUWUXsY,-1.4
1414,11.0,AND THEIR PLACE IS A RUN OF THE MILL ANIMATED ACTION ADVENTURE PLOT WITH A FEW CHUCKLES TROWN IN,dq3Nf_lMPnE,-0.6
800,23.0, WHICH EVERYONE CAN RELATE TO ,9J25DZhivz8,1.2
1250,2.0, I LIKE TO TEASE SOME MYSTERY AND GREAT PLOT WHAT COULDVE BEEN BUT THAN ALL IS EXPLAINED AND DISPPEARES TEN MINUTES LATER ITS JUST A CLEAR REMAKE OF PREDATOR FROM BACK IN 1997 WITH THE PREMISE BEING ALMOST IDENTICAL,pLTX3ipuDJI,-1.8
327,15.0,ITS THE SAME YOU KNOW RISE AND FALL,OtBXNcAL_lE,-0.4
1212,16.0,THE MAIN PROBLEM OF THIS MOVIE IS THAT THIS MOVIE IS SO CHEESY ,ZUXBRvtny7o,-2.0
1427,9.0,BUT THE M THE SCRIPT IS CORNY,wMbj6ajWbic,-2.0
82,2.0, AND IT ACTUALLY SURPRISED ME,k5Y_838nuGo,1.2
940,9.0,SIGH IT PROBABLY WOULD HAVE HELPED IF I WENT WITH WITH SOMEONE IF AT LEAST ONE OTHER ONE OTHER PERSON WENT WITH ME,tmZoasNr4rU,-0.6
157,19.0,AND AND AFTER THE MOVIE UM GOING OUT INTO THE THEATER INTO THE LOBBY I HAD NOONE I HEARD NOONE SAY ANYTHING GOOD,Nzq88NnDkEk,-2.4
1257,9.0,AND I KNOW YOU CANT HYPE A MOVIE WITH AN UNKNOWN ACTORS SO EVEN IF SOMEONE IS IN THERE FOR A FEW MINUTES YOU SHOULD HYPE THEM,pLTX3ipuDJI,0.0
121,10.0, I AM EIGHT YEARS OLD AND I THOUGHT IT WAS REALLY S KIND OF SCARY,6Egk_28TtTM,0.6
1139,7.0, AND UM THE STORY WAS PRETTY WEIRD,8qrpnFRGt2A,-1.6
786,9.0,THE VOICE ACTING IN THIS WAS INCREDIBLE,9J25DZhivz8,2.6
960,9.0, UM IM SURE KIDS ARE GONNA LOVE IT,1DmNV9C1hbY,2.2
558,41.0,JUST DONT SEE THIS MOVIE,d6hH302o4v8,-2.4
1239,9.0,AND ITS REALLY WELL WRITTEN,MLal-t_vJPM,2.0
12,3.0,AND PUT THEM IN A JUSTICE LEAGE MOVIE WITH THE RITUAL BATMAN AND SUPERMAN,Af8D0E4ZXaw,0.25
449,29.0, UM BUT I WILL SAY UM WITH THIS WITH THIS QUALITY OF 3D YOU COULD ALMOST MAKE YOU KNOW A REGULAR LIKE A DRAMATIC MOVIE OR AN ACTION MOVIE OR SOMETHING THAT WAS REALLY GOOD MOVIE AND YOU COULD MAKE IT 3D AND IT WOULDNT AT ALL ,LSi-o-IrDMs,1.4
440,20.0,COZ SOMETIMES 3D CAN MESS UP THE COLOR AT LEAST THE OLD ANAGLYPHIC 3D I THINK REAL D IT YOU KNOW HAD SORT OF HAD SORT OF TEMPTED BUT IT WINDS ITSELF ITS ALSO UM NOT IDEAL FOR FOR THE IMIGAE ITSLEF,LSi-o-IrDMs,-1.2
566,6.0, BUT THEY HAVE A LOT OF ADULT SITUATIONS IN IT,etzxEpPuc6I,0.4
323,11.0,AND DONT GET ME WRONG THERE WERE YOU KNOW FUNNY PARTS IN THE MOVIE,OtBXNcAL_lE,0.2
